{
  "certification_id": "SC-CERT-2026-0001",
  "schema_version": "1.0.0",
  "issued_date": "2026-07-13",
  "effective_date": "2026-07-13",
  "expiry_date": "2027-07-13",
  "status": "CERTIFIED",
  "certifier": {
    "id": "CERTIFIER-ALPHA-001",
    "name": "Alpha Certifier Node",
    "role": "Primary Certifier",
    "contact": "certifier@satoshium.example"
  },
  "subject": {
    "id": "SUBJECT-MODULE-001",
    "name": "Satoshium Core Validation Module v1.0",
    "type": "Software Module",
    "description": "The core validation module responsible for transaction integrity checks within the Satoshium Suite.",
    "version": "1.0.0",
    "repository": "https://github.com/example/satoshium-core"
  },
  "standard": {
    "id": "SATOSHIUM-STD-001",
    "name": "Satoshium Core Certification Standard",
    "version": "1.0",
    "reference_url": "https://satoshium.example/standards/STD-001"
  },
  "methodology": {
    "id": "SATOSHIUM-METHOD-001",
    "name": "Satoshium Structured Review Methodology",
    "version": "1.0",
    "description": "A structured review and evidence-based methodology for evaluating Satoshium Suite components."
  },
  "scope": {
    "summary": "Certification covers the core validation module's transaction integrity routines, input sanitization, and error handling as of version 1.0.0.",
    "inclusions": [
      "Transaction integrity validation routines",
      "Input sanitization logic",
      "Error handling and exception propagation"
    ],
    "exclusions": [
      "Network transport layer",
      "Third-party library internals",
      "Deployment infrastructure"
    ]
  },
  "outcome": {
    "status": "CERTIFIED",
    "summary": "The subject met all applicable requirements under the referenced standard using the specified methodology. All evidence items were collected, reviewed, and found consistent with certification criteria.",
    "determination_date": "2026-07-13",
    "conditions": [
      "Subject must re-certify upon any major version increment.",
      "Evidence items must be refreshed within 12 months."
    ]
  },
  "evidence_references": [
    {
      "evidence_id": "EVD-0001",
      "title": "Source Code Review Report",
      "type": "Review Report",
      "location": "https://evidence.satoshium.example/EVD-0001",
      "hash": "sha256:aabbccddeeff0011223344556677889900aabbccddeeff0011223344556677889",
      "collected_date": "2026-07-01"
    },
    {
      "evidence_id": "EVD-0002",
      "title": "Automated Test Suite Results",
      "type": "Test Report",
      "location": "https://evidence.satoshium.example/EVD-0002",
      "hash": "sha256:1122334455667788990011aabbccddeeff1122334455667788990011aabbccdd",
      "collected_date": "2026-07-05"
    },
    {
      "evidence_id": "EVD-0003",
      "title": "Security Assessment Summary",
      "type": "Security Assessment",
      "location": "https://evidence.satoshium.example/EVD-0003",
      "hash": "sha256:ffeeddccbbaa99887766554433221100ffeeddccbbaa99887766554433221100",
      "collected_date": "2026-07-08"
    }
  ],
  "related_artifacts": {
    "scpr_id": "SCPR-2026-0001",
    "scr_id": "SCR-2026-0001",
    "scrd_id": "SCRD-2026-0001",
    "sreg_id": "SREG-2026-0001",
    "schr_id": "SCHR-2026-0001",
    "anch_id": "ANCH-2026-0001",
    "satr_id": "SATR-2026-0001"
  },
  "notes": "Sample certification for the satoshium-certifier-ops-toolkit. All values are illustrative.",
  "metadata": {
    "created_by": "satoshium-certifier-ops-toolkit",
    "created_at": "2026-07-13T00:00:00Z",
    "last_modified_by": "satoshium-certifier-ops-toolkit",
    "last_modified_at": "2026-07-13T00:00:00Z",
    "tags": [
      "sample",
      "core-module",
      "v1.0"
    ]
  }
}
