{
  "certification_id": "FIXTURE-COMPLETE-0001",
  "schema_version": "1.0.0",
  "issued_date": "2026-07-13",
  "effective_date": "2026-07-13",
  "expiry_date": "2027-07-13",
  "status": "CERTIFIED",
  "certifier": {
    "id": "FIXTURE-CERTIFIER-001",
    "name": "Fixture Certifier Node",
    "role": "Primary Certifier",
    "contact": "fixture@satoshium.test"
  },
  "subject": {
    "id": "FIXTURE-SUBJECT-001",
    "name": "Fixture Test Subject v1.0",
    "type": "Software Module",
    "description": "A fully populated fixture package used to verify CI release checks pass.",
    "version": "1.0.0",
    "repository": "https://github.com/example/fixture-subject"
  },
  "standard": {
    "id": "FIXTURE-STD-001",
    "name": "Fixture Certification Standard",
    "version": "1.0",
    "reference_url": "https://satoshium.test/standards/FIXTURE-STD-001"
  },
  "methodology": {
    "id": "FIXTURE-METHOD-001",
    "name": "Fixture Review Methodology",
    "version": "1.0",
    "description": "Methodology used in the complete fixture for CI testing."
  },
  "scope": {
    "summary": "Complete scope for CI fixture testing.",
    "inclusions": ["All core routines"],
    "exclusions": ["Third-party internals"]
  },
  "outcome": {
    "status": "CERTIFIED",
    "summary": "All criteria met in the complete fixture.",
    "determination_date": "2026-07-13",
    "conditions": ["Re-certify on major version bump."]
  },
  "evidence_references": [
    {
      "evidence_id": "FIXTURE-EVD-001",
      "title": "Fixture Source Code Review",
      "type": "Review Report",
      "location": "https://evidence.satoshium.test/FIXTURE-EVD-001",
      "hash": "sha256:fixture000111222333444555666777888999aaabbbccc",
      "collected_date": "2026-07-01"
    }
  ],
  "related_artifacts": {
    "scpr_id": "SCPR-FIXTURE-0001",
    "scr_id": "SCR-FIXTURE-0001",
    "scrd_id": "SCRD-FIXTURE-0001",
    "sreg_id": "SREG-FIXTURE-0001",
    "schr_id": "SCHR-FIXTURE-0001",
    "anch_id": "ANCH-FIXTURE-0001",
    "satr_id": "SATR-FIXTURE-0001"
  },
  "notes": "Complete fixture for CI release check verification.",
  "metadata": {
    "created_by": "satoshium-certifier-ops-toolkit-test-suite",
    "created_at": "2026-07-13T00:00:00Z",
    "last_modified_by": "satoshium-certifier-ops-toolkit-test-suite",
    "last_modified_at": "2026-07-13T00:00:00Z",
    "tags": ["fixture", "ci", "complete"]
  }
}
